{
  "format": "vokabeltrainer-set",
  "formatVersion": 1,
  "set": {
    "title": "Englisch – Wetter",
    "termLanguage": "en",
    "meaningLanguage": "de"
  },
  "sections": [
    {
      "title": "Wetter",
      "entries": [
        {
          "term": "rain",
          "meanings": ["Regen"]
        },
        {
          "term": "cloud",
          "meanings": ["Wolke"]
        }
      ]
    }
  ]
}
