{
  "format": "vokabeltrainer-set",
  "formatVersion": 1,
  "set": {
    "title": "Englisch – Wetter",
    "termLanguage": "en",
    "meaningLanguage": "de",
    "level": "",
    "textbook": " ",
    "license": null,
    "notes": "",
    "reviewStatus": null
  },
  "sections": [
    {
      "title": "Wetter",
      "entries": [
        {
          "term": {
            "text": "rain",
            "acceptedVariants": []
          },
          "meanings": [
            {
              "text": "Regen",
              "acceptedVariants": null
            }
          ],
          "notes": "",
          "examples": [],
          "grammar": {},
          "reviewStatus": null
        },
        {
          "term": "cloud",
          "meanings": ["Wolke"],
          "notes": null,
          "examples": [
            {
              "text": "A dark cloud.",
              "translation": ""
            }
          ],
          "grammar": {
            "partOfSpeech": "",
            "plural": null,
            "forms": []
          }
        }
      ]
    }
  ]
}
